{
  "id": "model-training",
  "title": "모델 학습과 튜닝",
  "audience": "모델 학습·튜닝 업무를 준비하는 학습자",
  "description": "학습의 수학적 기초부터 사후학습과 경량화까지 다루는 백과 과정이다.",
  "steps": [
    {
      "ref": "probability",
      "required": true,
      "reason": "과정의 공통 언어와 출발점을 먼저 확립한다."
    },
    {
      "ref": "gradient",
      "required": true,
      "reason": "앞 단계의 개념을 확장해 다음 주제를 이해하기 위한 연결 고리를 만든다."
    },
    {
      "ref": "optimization",
      "required": true,
      "reason": "앞 단계의 개념을 확장해 다음 주제를 이해하기 위한 연결 고리를 만든다."
    },
    {
      "ref": "loss-function",
      "required": true,
      "reason": "앞 단계의 개념을 확장해 다음 주제를 이해하기 위한 연결 고리를 만든다."
    },
    {
      "ref": "backpropagation",
      "required": true,
      "reason": "앞 단계의 개념을 확장해 다음 주제를 이해하기 위한 연결 고리를 만든다."
    },
    {
      "ref": "gradient-descent",
      "required": true,
      "reason": "앞 단계의 개념을 확장해 다음 주제를 이해하기 위한 연결 고리를 만든다."
    },
    {
      "ref": "learning-rate",
      "required": true,
      "reason": "앞 단계의 개념을 확장해 다음 주제를 이해하기 위한 연결 고리를 만든다."
    },
    {
      "ref": "pretraining",
      "required": true,
      "reason": "앞 단계의 개념을 확장해 다음 주제를 이해하기 위한 연결 고리를 만든다."
    },
    {
      "ref": "fine-tuning",
      "required": true,
      "reason": "앞 단계의 개념을 확장해 다음 주제를 이해하기 위한 연결 고리를 만든다."
    },
    {
      "ref": "supervised-fine-tuning",
      "required": true,
      "reason": "앞 단계의 개념을 확장해 다음 주제를 이해하기 위한 연결 고리를 만든다."
    },
    {
      "ref": "instruction-tuning",
      "required": true,
      "reason": "앞 단계의 개념을 확장해 다음 주제를 이해하기 위한 연결 고리를 만든다."
    },
    {
      "ref": "rlhf",
      "required": true,
      "reason": "앞 단계의 개념을 확장해 다음 주제를 이해하기 위한 연결 고리를 만든다."
    },
    {
      "ref": "reward-model",
      "required": true,
      "reason": "앞 단계의 개념을 확장해 다음 주제를 이해하기 위한 연결 고리를 만든다."
    },
    {
      "ref": "dpo",
      "required": true,
      "reason": "앞 단계의 개념을 확장해 다음 주제를 이해하기 위한 연결 고리를 만든다."
    },
    {
      "ref": "lora",
      "required": false,
      "reason": "앞 단계의 개념을 확장해 다음 주제를 이해하기 위한 연결 고리를 만든다."
    },
    {
      "ref": "peft",
      "required": false,
      "reason": "앞 단계의 개념을 확장해 다음 주제를 이해하기 위한 연결 고리를 만든다."
    },
    {
      "ref": "knowledge-distillation",
      "required": false,
      "reason": "앞 단계의 개념을 확장해 다음 주제를 이해하기 위한 연결 고리를 만든다."
    },
    {
      "ref": "quantization",
      "required": false,
      "reason": "앞 단계의 개념을 확장해 다음 주제를 이해하기 위한 연결 고리를 만든다."
    }
  ]
}
